{
  "schemaVersion": 1,
  "contract": "kungfu-buildchain-next-development-transition/v1",
  "idempotencyKey": "sha256:37ee52799584a989b059db060b7ce062feb56fbeff452033245046fdf3b21e78",
  "repository": "example/widget",
  "completedAlpha": {
    "outcome": "succeeded",
    "version": "1.4.2-alpha.7",
    "exactTag": "v1.4.2-alpha.7",
    "releaseSha": "1111111111111111111111111111111111111111",
    "treeSha": "2222222222222222222222222222222222222222",
    "publicationRoot": "sha256:3333333333333333333333333333333333333333333333333333333333333333",
    "completedAt": "2026-08-11T01:00:00.000Z"
  },
  "completedAlphaRoot": "sha256:18e65c63aba0df789e0b0e68903733825d87e292b82bcb8fd3793ca45dca6266",
  "alphaOutcome": "preserved-success",
  "model": {
    "strategy": "semver",
    "next": "auto"
  },
  "target": {
    "version": "1.4.2-alpha.8",
    "anchor": null
  },
  "declaredPaths": ["package.json"],
  "adapter": {
    "environmentVariable": "BUILDCHAIN_VERSION",
    "sourcePaths": ["package.json"],
    "derivedPaths": [],
    "allowedChangePaths": ["package.json"],
    "readOnlyPaths": [],
    "derivationStage": null,
    "verificationStage": "lifecycle.verify"
  },
  "effectBounds": {
    "allowedPaths": ["package.json"],
    "refUpdates": [],
    "forbiddenRefNamespaces": ["refs/heads/alpha/", "refs/tags/"]
  },
  "state": {
    "status": "planned",
    "generation": 1,
    "stateRoot": "sha256:4ef8ac1ff07cb14633994625e65a340acb3130ae56bbc88ee81504f09df3fa0f"
  },
  "materialization": null,
  "transitions": []
}
